{
  "$schema": "https://json-schema.org/draft/2020-12/schema",
  "$id": "https://llm-temporal-worker.dev/schema/llm.temporal/v1/generate-request.json",
  "title": "llm.temporal/v1 GenerateRequest",
  "type": "object",
  "additionalProperties": false,
  "required": ["api_version", "operation_key", "context", "append"],
  "properties": {
    "api_version": {"const": "llm.temporal/v1"},
    "operation_key": {"type": "string", "minLength": 1, "maxLength": 256},
    "context": {"$ref": "#/$defs/context"},
    "parent": {"type": ["string", "null"], "minLength": 1, "maxLength": 512},
    "append": {"type": "array", "items": {"$ref": "#/$defs/request_item"}, "maxItems": 10000},
    "settings_patch": {"$ref": "#/$defs/settings_patch"},
    "cache": {"$ref": "#/$defs/cache"}
  },
  "$defs": {
    "context": {
      "type": "object", "additionalProperties": false,
      "required": ["tenant", "project", "actor"],
      "properties": {
        "tenant": {"type": "string", "minLength": 1, "maxLength": 256},
        "project": {"type": "string", "minLength": 1, "maxLength": 256},
        "actor": {"type": "string", "minLength": 1, "maxLength": 256}
      }
    },
    "cache": {
      "type": "object", "additionalProperties": false,

      "properties": {
        "max_age_seconds": {"type": "integer", "minimum": 1, "maximum": 31536000},
        "variant": {"type": "integer", "minimum": 0, "maximum": 2147483647, "default": 0}
      }
    },
    "set_or_clear": {
      "oneOf": [
        {"type": "object", "additionalProperties": false, "required": ["set"], "properties": {"set": {}}},
        {"type": "object", "additionalProperties": false, "required": ["clear"], "properties": {"clear": {"const": true}}}
      ]
    },
    "settings_patch": {
      "type": "object", "additionalProperties": false,
      "properties": {
        "web_search": {"$ref": "#/$defs/bool_patch"},
        "web_fetch": {"$ref": "#/$defs/bool_patch"},
        "code_execution": {"$ref": "#/$defs/bool_patch"},
        "model": {"$ref": "#/$defs/model_patch"},
        "service_class": {"$ref": "#/$defs/service_patch"},
        "service_class_fallbacks": {"$ref": "#/$defs/service_list_patch"},
        "portability": {"$ref": "#/$defs/portability_patch"},
        "instructions": {"$ref": "#/$defs/instruction_list_patch"},
        "tools": {"$ref": "#/$defs/tool_list_patch"},
        "tool_policy": {"$ref": "#/$defs/tool_policy_patch"},
        "output": {"$ref": "#/$defs/output_patch"},
        "temperature": {"$ref": "#/$defs/temperature_patch"},
        "top_p": {"$ref": "#/$defs/top_p_patch"},
        "stop_sequences": {"$ref": "#/$defs/stop_sequences_patch"},
        "seed": {"$ref": "#/$defs/seed_patch"},
        "reasoning_mode": {"$ref": "#/$defs/reasoning_mode_patch"},
        "reasoning_token_budget": {"$ref": "#/$defs/reasoning_token_budget_patch"},
        "reasoning_effort": {"$ref": "#/$defs/reasoning_effort_patch"},
        "reasoning_summary": {"$ref": "#/$defs/reasoning_summary_patch"},
        "compaction_policy": {"$ref": "#/$defs/compaction_patch"},
        "extensions": {"$ref": "#/$defs/extensions_patch"}
      }
    },
    "bool_patch": {"oneOf": [{"type":"object","additionalProperties":false,"required":["set"],"properties":{"set":{"type":"boolean"}}},{"type":"object","additionalProperties":false,"required":["clear"],"properties":{"clear":{"const":true}}}]},
    "model_patch": {"oneOf": [{"type": "object", "additionalProperties": false, "required": ["set"], "properties": {"set": {"type": "string", "minLength": 1, "maxLength": 256}}}, {"type": "object", "additionalProperties": false, "required": ["clear"], "properties": {"clear": {"const": true}}}]},
    "service_patch": {"oneOf": [{"type": "object", "additionalProperties": false, "required": ["set"], "properties": {"set": {"enum": ["economy", "standard", "priority"]}}}, {"type": "object", "additionalProperties": false, "required": ["clear"], "properties": {"clear": {"const": true}}}]},
    "service_list_patch": {"oneOf": [{"type": "object", "additionalProperties": false, "required": ["set"], "properties": {"set": {"type": "array", "uniqueItems": true, "items": {"enum": ["economy", "standard", "priority"]}}}}, {"type": "object", "additionalProperties": false, "required": ["clear"], "properties": {"clear": {"const": true}}}]},
    "portability_patch": {"oneOf": [{"type": "object", "additionalProperties": false, "required": ["set"], "properties": {"set": {"enum": ["strict", "best_effort"]}}}, {"type": "object", "additionalProperties": false, "required": ["clear"], "properties": {"clear": {"const": true}}}]},
    "instruction_list_patch": {"oneOf": [{"type": "object", "additionalProperties": false, "required": ["set"], "properties": {"set": {"type": "array", "items": {"$ref": "#/$defs/instruction"}}}}, {"type": "object", "additionalProperties": false, "required": ["clear"], "properties": {"clear": {"const": true}}}]},
    "tool_list_patch": {"oneOf": [{"type": "object", "additionalProperties": false, "required": ["set"], "properties": {"set": {"type": "array", "items": {"$ref": "#/$defs/tool"}}}}, {"type": "object", "additionalProperties": false, "required": ["clear"], "properties": {"clear": {"const": true}}}]},
    "tool_policy_patch": {"oneOf": [{"type": "object", "additionalProperties": false, "required": ["set"], "properties": {"set": {"$ref": "#/$defs/tool_policy"}}}, {"type": "object", "additionalProperties": false, "required": ["clear"], "properties": {"clear": {"const": true}}}]},
    "output_patch": {"oneOf": [{"type": "object", "additionalProperties": false, "required": ["set"], "properties": {"set": {"$ref": "#/$defs/output"}}}, {"type": "object", "additionalProperties": false, "required": ["clear"], "properties": {"clear": {"const": true}}}]},
    "temperature_patch": {"oneOf": [{"type": "object", "additionalProperties": false, "required": ["set"], "properties": {"set": {"type": "string", "pattern": "^(0|[1-9][0-9]{0,19})(\\.[0-9]{1,18})?$", "description": "Canonical non-negative decimal string; legacy numeric input is accepted by the Go decoder during the v1 compatibility window."}}}, {"type": "object", "additionalProperties": false, "required": ["clear"], "properties": {"clear": {"const": true}}}]},
    "top_p_patch": {"oneOf": [{"type": "object", "additionalProperties": false, "required": ["set"], "properties": {"set": {"type": "string", "maxLength": 20, "pattern": "^(0\\.[0-9]{0,17}[1-9][0-9]{0,17}|1(\\.0{1,18})?)$", "description": "Decimal string greater than 0 and at most 1, with at most 18 fractional digits."}}}, {"type": "object", "additionalProperties": false, "required": ["clear"], "properties": {"clear": {"const": true}}}]},
    "stop_sequences_patch": {"oneOf": [{"type": "object", "additionalProperties": false, "required": ["set"], "properties": {"set": {"type": "array", "minItems": 1, "maxItems": 16, "uniqueItems": true, "items": {"type": "string", "minLength": 1, "maxLength": 256}}}}, {"type": "object", "additionalProperties": false, "required": ["clear"], "properties": {"clear": {"const": true}}}]},
    "seed_patch": {"oneOf": [{"type": "object", "additionalProperties": false, "required": ["set"], "properties": {"set": {"type": "integer", "minimum": 0, "maximum": 9007199254740991}}}, {"type": "object", "additionalProperties": false, "required": ["clear"], "properties": {"clear": {"const": true}}}]},
    "reasoning_mode_patch": {"oneOf": [{"type": "object", "additionalProperties": false, "required": ["set"], "properties": {"set": {"enum": ["provider_default", "disabled", "adaptive", "enabled"]}}}, {"type": "object", "additionalProperties": false, "required": ["clear"], "properties": {"clear": {"const": true}}}]},
    "reasoning_token_budget_patch": {"oneOf": [{"type": "object", "additionalProperties": false, "required": ["set"], "properties": {"set": {"type": "integer", "minimum": 1, "maximum": 2147483647}}}, {"type": "object", "additionalProperties": false, "required": ["clear"], "properties": {"clear": {"const": true}}}]},
    "reasoning_effort_patch": {"oneOf": [{"type": "object", "additionalProperties": false, "required": ["set"], "properties": {"set": {"enum": ["provider_default", "minimal", "low", "medium", "high", "xhigh", "maximum"]}}}, {"type": "object", "additionalProperties": false, "required": ["clear"], "properties": {"clear": {"const": true}}}]},
    "reasoning_summary_patch": {"oneOf": [{"type": "object", "additionalProperties": false, "required": ["set"], "properties": {"set": {"enum": ["provider_default", "none", "auto", "concise", "detailed"]}}}, {"type": "object", "additionalProperties": false, "required": ["clear"], "properties": {"clear": {"const": true}}}]},
    "compaction_patch": {"oneOf": [{"type": "object", "additionalProperties": false, "required": ["set"], "properties": {"set": {"$ref": "#/$defs/compaction_policy"}}}, {"type": "object", "additionalProperties": false, "required": ["clear"], "properties": {"clear": {"const": true}}}]},
    "compaction_policy": {"type": "object", "additionalProperties": false, "description": "Partial generic compaction policy; omitted fields take the worker defaults (trigger_tokens 12000, target_tokens 8000). The worker also requires target_tokens to be lower than trigger_tokens after defaults apply.", "properties": {"version": {"const": "generic-2026-07-18"}, "prompt_version": {"const": "v1"}, "summary_style": {"enum": ["concise", "balanced", "detailed"]}, "trigger_tokens": {"type": "integer", "minimum": 1, "maximum": 10000000}, "target_tokens": {"type": "integer", "minimum": 1, "maximum": 9999999}, "recent_turns": {"type": "integer", "minimum": 0, "maximum": 1000}, "output_reserve_tokens": {"type": "integer", "minimum": 1, "maximum": 1000000}, "materialization_threshold_bytes": {"type": "integer", "minimum": 0, "maximum": 1073741824}}},
    "extensions_patch": {"oneOf": [{"type": "object", "additionalProperties": false, "required": ["set"], "properties": {"set": {"type": "object"}}}, {"type": "object", "additionalProperties": false, "required": ["clear"], "properties": {"clear": {"const": true}}}]},
    "instruction": {
      "oneOf": [
        {"type": "object", "additionalProperties": false, "required": ["kind", "text"], "properties": {"kind": {"const": "text"}, "level": {"enum": ["application", "policy"]}, "text": {"type": "string", "minLength": 1}}},
        {"type": "object", "additionalProperties": false, "required": ["kind", "content"], "properties": {"kind": {"const": "parts"}, "level": {"enum": ["application", "policy"]}, "content": {"type": "array", "minItems": 1, "items": {"$ref": "#/$defs/request_part"}}}}
      ]
    },
    "request_item": {
      "description": "An appended item. Request content must be non-empty: a message needs at least one part and no empty text part.",
      "allOf": [{"$ref": "#/$defs/item"}],
      "if": {"required": ["kind"], "properties": {"kind": {"const": "message"}}},
      "then": {"properties": {"content": {"minItems": 1, "items": {"$ref": "#/$defs/request_part"}}}}
    },
    "request_part": {
      "description": "A message or instruction part in a request. A text part's text must be non-empty.",
      "allOf": [{"$ref": "#/$defs/part"}],
      "if": {"required": ["kind"], "properties": {"kind": {"const": "text"}}},
      "then": {"properties": {"text": {"minLength": 1}}}
    },
    "item": {
      "oneOf": [
        {"type": "object", "additionalProperties": false, "required": ["kind", "actor", "content"], "properties": {"kind": {"const": "message"}, "actor": {"enum": ["human", "model"]}, "content": {"type": "array", "items": {"$ref": "#/$defs/part"}}}},
        {"type": "object", "additionalProperties": false, "required": ["kind", "id", "name", "arguments"], "properties": {"kind": {"const": "tool_call"}, "id": {"type": "string", "minLength": 1}, "name": {"type": "string", "pattern": "^[A-Za-z0-9_-]{1,64}$"}, "arguments": {}}},
        {"type": "object", "additionalProperties": false, "required": ["kind", "call_id", "content", "is_error"], "properties": {"kind": {"const": "tool_result"}, "call_id": {"type": "string", "minLength": 1}, "name": {"type": "string"}, "content": {"type": "array", "items": {"$ref": "#/$defs/part"}}, "is_error": {"type": "boolean"}}},
        {"type": "object", "additionalProperties": false, "required": ["kind", "provider", "endpoint_family", "media_type", "opaque"], "properties": {"kind": {"const": "provider_state"}, "provider": {"type": "string", "minLength": 1}, "endpoint_family": {"type": "string", "minLength": 1}, "media_type": {"type": "string", "minLength": 1}, "opaque": {"$ref": "#/$defs/opaque"}}},
        {"type": "object", "additionalProperties": false, "required": ["kind", "uri"], "properties": {"kind": {"const": "reference"}, "uri": {"type": "string", "pattern": "^[A-Za-z][A-Za-z0-9+.-]*:", "description": "URI with a scheme; the worker rejects the javascript and data schemes."}, "metadata": {"type": "object", "propertyNames": {"minLength": 1}}}}
      ]
    },
    "part": {
      "oneOf": [
        {"type": "object", "additionalProperties": false, "required": ["kind", "text"], "properties": {"kind": {"const": "text"}, "text": {"type": "string"}}},
        {"type": "object", "additionalProperties": false, "required": ["kind", "media_type"], "properties": {"kind": {"const": "image"}, "media_type": {"$ref": "#/$defs/media_type"}, "url": {"$ref": "#/$defs/media_url"}, "bytes": {"type": "string", "contentEncoding": "base64", "minLength": 1}, "blob": {"$ref": "#/$defs/blob"}, "detail": {"type": "string"}}, "oneOf": [{"required": ["url"]}, {"required": ["bytes"]}, {"required": ["blob"]}]},
        {"type": "object", "additionalProperties": false, "required": ["kind", "media_type"], "properties": {"kind": {"const": "document"}, "media_type": {"$ref": "#/$defs/media_type"}, "url": {"$ref": "#/$defs/media_url"}, "bytes": {"type": "string", "contentEncoding": "base64", "minLength": 1}, "blob": {"$ref": "#/$defs/blob"}, "title": {"type": "string"}}, "oneOf": [{"required": ["url"]}, {"required": ["bytes"]}, {"required": ["blob"]}]},
        {"type": "object", "additionalProperties": false, "required": ["kind", "value"], "properties": {"kind": {"const": "json"}, "value": {}}},
        {"type": "object", "additionalProperties": false, "required": ["kind", "text"], "properties": {"kind": {"const": "refusal"}, "text": {"type": "string"}, "provider_code": {"type": "string"}}},
        {"type": "object", "additionalProperties": false, "required": ["kind", "provider", "endpoint_family", "media_type", "opaque"], "properties": {"kind": {"const": "provider_state"}, "provider": {"type": "string", "minLength": 1}, "endpoint_family": {"type": "string", "minLength": 1}, "media_type": {"type": "string", "minLength": 1}, "opaque": {"$ref": "#/$defs/opaque"}}}
      ]
    },
    "media_type": {"type": "string", "minLength": 1, "pattern": "^[^\\r\\n]+$"},
    "media_url": {"type": "string", "pattern": "^https?://", "description": "Remote media URL; the worker also rejects URLs with user information and local, private or metadata hosts."},
    "blob": {"type": "object", "additionalProperties": false, "required": ["digest", "byte_length", "media_type", "locator"], "properties": {"digest": {"type": "string", "minLength": 1}, "byte_length": {"type": "integer", "minimum": 0}, "media_type": {"$ref": "#/$defs/media_type", "description": "Must equal the enclosing part's media_type."}, "locator": {"type": "string", "minLength": 1}}},
    "opaque": {"type": "string", "contentEncoding": "base64", "description": "Uninterpreted provider continuation bytes in standard base64."},
    "tool": {"type": "object", "additionalProperties": false, "required": ["name", "description", "input_schema"], "properties": {"kind": {"enum": ["function", "provider", "remote_mcp"]}, "name": {"type": "string", "pattern": "^[A-Za-z0-9_-]{1,64}$"}, "description": {"type": "string"}, "input_schema": {"type": "object"}, "output_schema": {"type": "object"}}},
    "tool_policy": {"type": "object", "additionalProperties": false, "required": ["mode", "parallel"], "properties": {"mode": {"enum": ["none", "auto", "required", "named"]}, "name": {"type": "string"}, "parallel": {"type": "boolean"}}},
    "output": {"type": "object", "additionalProperties": false, "required": ["format"], "properties": {"max_tokens": {"type": "integer", "minimum": 0}, "format": {"type": "object", "additionalProperties": false, "required": ["kind"], "properties": {"kind": {"enum": ["text", "json", "json_schema"]}, "name": {"type": "string", "pattern": "^[A-Za-z0-9_-]{1,64}$"}, "description": {"type": "string"}, "schema": {"type": "object"}, "strict": {"type": "boolean"}}}}}
  }
}
