{"api_version":"llm.temporal/v1","append":[{"actor":"human","content":[{"kind":"text","text":"Assess."}],"kind":"message"}],"cache":{"max_age_seconds":300,"variant":7},"context":{"actor":"forecast-workflow","project":"ai-ach","tenant":"att"},"operation_key":"forecast/turn/1","settings_patch":{"instructions":{"set":[{"kind":"text","text":"Return a result."}]},"model":{"set":"model/test"},"output":{"set":{"format":{"kind":"json_schema","name":"forecast","schema":{"additionalProperties":false,"properties":{"answer":{"type":"string"}},"required":["answer"],"type":"object"},"strict":true}}},"reasoning_effort":{"set":"medium"},"tool_policy":{"set":{"mode":"auto","parallel":false}},"tools":{"set":[{"description":"Search evidence.","input_schema":{"additionalProperties":false,"properties":{"query":{"type":"string"}},"required":["query"],"type":"object"},"name":"web_search"}]}}}